objectid,filename,youtubeid,vimeoid,title,creator,date,description,subject,location,latitude,longitude,source,identifier,type,format,language,rights,rightsstatement
birthright-2024,birthright-2024.jpg,,,Birthright: A Vision into the Plight of Southeastern Indigenous Culture through the Eyes of Guernica,John Henry Gloyne,2024,"A ""remix of Picassos Guernica"" that ""depicts the horrors of colonialism and mound desecration from a Cherokee perspective.""",Cherokee;animals;death;mound,"Eastern Band Territory, Cherokee, NC",35.47694,83.32028,McClung Museum,2024.12.1,Image;StillImage,image/jpeg,,,
jar-1958,jar-1958.jpg,,,Jar,Unknown,1662,A porcelain jar from the Kangxi era (1662-1722) containing European bronze mounts.,vase;porcelain,China,35.8593,104.1361,McClung Museum,1958.5.186,Image;PhysicalObject,image/jpeg,,,
Australopithecus_Afarensis-2024,Australopithecus Afarensis-2024.jpeg,,,The Facial recreation of Astralopithacus Afarensis using understanding of Primate and human anatomy,John Gurche,2024,"The facial reconstruction of Australopithacus Afarensis who was a ape like face proportion, small brain, With Long Arm and curved fingers. As bipeds they had human like spine, hips and knees.",Anthropology; Human Evolution; recisntrcution,"Hadar, East Africa ",11.1932,40.599,McClung Museum,2024,Image; Physical Object,image/jpeg,,,
Tray-1900,Tray-1900.jpeg,,,A Minakari Tray from Iran/Pakistan,Mr. & Mrs. Louis Bailey Audigier,1934,"A tray made out of copper and enamel (Minakari), which is the art of ornamenting the surface of metal by opowdered glass. On this tray radiating description says ""Allah"", ""Malik"" and ""Mohammad"" ( partial).  The dot in the centre is skewd to onside, an intended imperfection signifying that only god is perfect",Tray; Minamari; artifact,Iran/Pakistan,21,61.33,McClung Museum,1934.1.328,Image; Physical object,image/jpeg,,,
Peacock_Panel-1800-1,Peacock Panel-1800-1.jpeg,,,A Mughal Dynasty panel made of sandstone from Unknown Mughal Pavillion,Ardath & Joel E. Rynning Acquisition funds,2018,"The Panel is on of the 2 facades of a grand but. unknown Mughal pavillion from Northern India. It depicts a Peacock (Which is currently the national bird of India) with a snake in its mouth. The large fanned tail that fills most of the cusped Arch is known as Mihrab- a niche in a wall that points towards Mecca, the direction in which Muslims pray. ",Object:  Panel: Mughal Dynasty: Norhtern India,Northern India ,27.18,78.02,McClung Museum,2018.11,Image; Physical object,Image/jpeg,,,